{
  "$schema": "http://json-schema.org/draft-07/schema#",
  "$id": "loa.construct.invocation.v0",
  "title": "ConstructInvocationEnvelope",
  "description": "Per-stage invocation envelope for the Construct Bounded-Context Runtime Substrate (cycle-construct-bounded-context, SDD §3.1). Captures everything a runner needs to execute a single construct stage: identity, domain claim, mode, input streams, allowed context, isolation policy, output contract, and hash-chain linkage. Schema version: v0 (initial). Future versions append fields under additionalProperties:false in extension blocks; breaking changes bump to v1.",
  "type": "object",
  "additionalProperties": false,
  "required": [
    "schema_version",
    "run_id",
    "composition_id",
    "stage_id",
    "stage_pass",
    "construct",
    "domain",
    "mode",
    "input_streams",
    "allowed_context",
    "context_policy",
    "output_contract",
    "prev_hash",
    "invocation_hash"
  ],
  "properties": {
    "schema_version": {
      "type": "string",
      "const": "loa.construct.invocation.v0",
      "description": "Schema id literal. Bumping requires migration runbook (FR-1.4)."
    },
    "run_id": {
      "type": "string",
      "pattern": "^run_[A-Za-z0-9_-]{1,128}$",
      "maxLength": 140,
      "description": "Per-run identifier. Stable across all stages of a single composition execution."
    },
    "composition_id": {
      "type": "string",
      "pattern": "^[A-Za-z0-9_./-]+@sha256:[0-9a-f]{12,64}$",
      "maxLength": 256,
      "description": "Deterministic composition identity per FR-1.5 / SDD §3.1. Format: '{basename(path)}@sha256:{first_12_chars(sha256(jcs_canonicalize(yaml_content)))}'. Stable across formatting changes; unstable across semantic changes."
    },
    "stage_id": {
      "type": "string",
      "pattern": "^[A-Za-z0-9_-]+\\.stage-[0-9]+$",
      "maxLength": 128,
      "description": "Per-stage identifier within a composition. Pattern: '<composition-slug>.stage-<n>'. FR-5.1: included in persistent-state composite key to prevent same-skill-multi-stage collisions."
    },
    "stage_pass": {
      "type": "integer",
      "minimum": 1,
      "description": "Iteration pass counter. 1 = first run; >1 = re-entry under composition.iterate. Distinct from cycle_count in run state."
    },
    "construct": {
      "type": "object",
      "additionalProperties": false,
      "required": ["slug", "version", "skill"],
      "properties": {
        "slug": {
          "type": "string",
          "pattern": "^[a-z][a-z0-9_-]{0,63}$",
          "description": "Pack slug (lowercase, hyphen-separated). Must resolve in installed pack registry."
        },
        "version": {
          "type": "string",
          "pattern": "^[0-9]+\\.[0-9]+\\.[0-9]+(-[A-Za-z0-9.-]+)?$",
          "description": "Pack semver."
        },
        "persona": {
          "type": "string",
          "maxLength": 64,
          "description": "Optional persona handle (e.g. 'ALEXANDER', 'STAMETS'). Free-form per composition.schema.json convention."
        },
        "skill": {
          "type": "string",
          "pattern": "^[a-z][a-z0-9_-]{0,63}$",
          "description": "Skill slug within the pack."
        }
      }
    },
    "domain": {
      "type": "object",
      "additionalProperties": false,
      "required": ["primary"],
      "properties": {
        "primary": {
          "type": "string",
          "minLength": 1,
          "maxLength": 80,
          "description": "Stage's bounded-context primary tag. SDD §3.1: must align with construct manifest unless explicitly overridden by composition."
        },
        "active_language": {
          "type": "array",
          "items": { "type": "string", "maxLength": 100 },
          "maxItems": 50,
          "description": "Ubiquitous-language tokens active at this stage."
        },
        "invariants": {
          "type": "array",
          "items": { "type": "string", "maxLength": 280 },
          "maxItems": 20,
          "description": "Domain invariants the construct asserts; auditable surface."
        }
      }
    },
    "mode": {
      "type": "string",
      "enum": ["fresh", "persistent", "blocking"],
      "description": "Stage execution mode. 'fresh' = clean subprocess, no prior context (SDD §2.1). 'persistent' = teammate accumulates context across iterations (FR-7). 'blocking' = stage halts the chain on emit, awaits operator continuation."
    },
    "input_streams": {
      "type": "array",
      "items": { "$ref": "#/$defs/StreamRef" },
      "maxItems": 100,
      "description": "Hash-pinned upstream stream references this stage will read."
    },
    "allowed_context": {
      "type": "object",
      "additionalProperties": false,
      "description": "Whitelisted context buckets the runner may surface to the construct. Beyond these, surfacing is forbidden (FR-13.2).",
      "properties": {
        "methodology": {
          "type": "array",
          "items": { "type": "string", "maxLength": 400 },
          "maxItems": 100,
          "description": "Skill / methodology files."
        },
        "topology": {
          "type": "array",
          "items": { "type": "string", "maxLength": 400 },
          "maxItems": 100,
          "description": "PRD / SDD / project-topology files."
        },
        "operator_model": {
          "type": "array",
          "items": { "type": "string", "maxLength": 400 },
          "maxItems": 50,
          "description": "Operator-model context per cycle-098 Operator-Model stream."
        }
      }
    },
    "context_policy": {
      "type": "object",
      "additionalProperties": false,
      "required": [
        "include_prior_transcript",
        "include_unread_stage_outputs",
        "include_unlisted_grimoires",
        "allowed_read_paths",
        "allowed_write_paths",
        "allowed_env_vars",
        "allow_network",
        "allowed_egress",
        "llm_session_strategy",
        "allowed_mcp_tools",
        "isolation_tier"
      ],
      "description": "Per-stage isolation contract. Strict-tier runners enforce kernel-side; advisory-tier runners enforce cooperatively (SDD §6.5b).",
      "properties": {
        "include_prior_transcript": {
          "type": "boolean",
          "description": "If false, prior LLM transcript is not surfaced (FR-4.3 leak vector 1)."
        },
        "include_unread_stage_outputs": {
          "type": "boolean",
          "description": "If false, only declared input_streams are accessible — no peek at sibling stage outputs."
        },
        "include_unlisted_grimoires": {
          "type": "boolean",
          "description": "If false, only files in allowed_read_paths are surfaced from grimoires/."
        },
        "allowed_read_paths": {
          "type": "array",
          "items": { "type": "string", "maxLength": 400 },
          "maxItems": 200,
          "description": "Path globs the construct may read. Strict tier enforces via bwrap --ro-bind; advisory via LD_PRELOAD/dyld interposition + cooperative check."
        },
        "allowed_write_paths": {
          "type": "array",
          "items": { "type": "string", "maxLength": 400 },
          "maxItems": 100,
          "description": "Path globs the construct may write. Strict tier enforces via bwrap --bind; advisory via post-exec output validator + cooperative check."
        },
        "allowed_env_vars": {
          "type": "array",
          "items": { "type": "string", "pattern": "^[A-Z_][A-Z0-9_]*$", "maxLength": 64 },
          "maxItems": 100,
          "description": "Env var allowlist. Subprocess runs under env -i + only these names passed through (FR-4.1)."
        },
        "allow_network": {
          "type": "boolean",
          "description": "Master toggle for network egress. When false, allowed_egress MUST be []."
        },
        "allowed_egress": {
          "type": "array",
          "items": {
            "type": "string",
            "pattern": "^[A-Za-z0-9.-]+:[0-9]+$",
            "maxLength": 300
          },
          "maxItems": 50,
          "description": "Host:port allowlist for network egress. Strict tier enforces via Linux netns + CONNECT proxy (SDD §2.3); advisory via HTTP_PROXY env (HTTP/HTTPS-aware code only). When allow_network is false, this MUST be empty."
        },
        "llm_session_strategy": {
          "type": "string",
          "enum": ["fresh", "continue"],
          "description": "Per-stage LLM session policy. 'fresh' = new session id + provider memory disable verified (strict) or attempted (advisory). 'continue' = explicit opt-in to reuse, banned in mode:fresh stages."
        },
        "allowed_mcp_tools": {
          "type": "array",
          "items": { "type": "string", "maxLength": 200 },
          "maxItems": 50,
          "description": "MCP tool allowlist enforced via cheval adapter."
        },
        "network_namespace": {
          "type": "boolean",
          "description": "Linux-only opt-in to spawn under --unshare-net. Required for strict-tier network claims; ignored on macOS/Windows (advisory only)."
        },
        "isolation_tier": {
          "type": "string",
          "enum": ["strict", "compatibility", "advisory"],
          "description": "Tier under which this stage will run. Resolved from .claude/data/construct-validation-tiers.yaml at composition load time. Strict = kernel-enforced; compatibility = generated-contract-enforced; advisory = warn-only."
        },
        "network_isolation_class": {
          "type": "string",
          "enum": ["kernel", "cooperative", "none"],
          "description": "Captured at envelope build time so handoff and audit can attest the actual isolation class achieved (NOT what was requested). 'kernel' = bwrap+netns; 'cooperative' = HTTP_PROXY-aware; 'none' = no enforcement."
        }
      },
      "allOf": [
        {
          "if": { "properties": { "allow_network": { "const": false } }, "required": ["allow_network"] },
          "then": { "properties": { "allowed_egress": { "maxItems": 0 } } }
        }
      ]
    },
    "output_contract": {
      "type": "object",
      "additionalProperties": false,
      "required": ["writes"],
      "description": "Declared writes the stage promises to produce (FR-11). Post-exec validator enforces (SDD §4.4).",
      "properties": {
        "writes": {
          "type": "array",
          "items": {
            "type": "object",
            "additionalProperties": false,
            "required": ["type", "schema_id", "destination", "required"],
            "properties": {
              "type": {
                "type": "string",
                "enum": ["Signal", "Verdict", "Artifact", "Intent", "OperatorModel"],
                "description": "Stream type per Typed-Streams Protocol."
              },
              "schema_id": {
                "type": "string",
                "pattern": "^loa\\.stream\\.[A-Za-z]+\\.v[0-9]+$",
                "maxLength": 80
              },
              "destination": {
                "type": "string",
                "maxLength": 400,
                "description": "Output path (must be inside context_policy.allowed_write_paths)."
              },
              "required": {
                "type": "boolean",
                "description": "FR-11.1: count enforcement. If true, missing output → [OUTPUT-CONTRACT-VIOLATION]."
              },
              "domain": {
                "type": "object",
                "additionalProperties": false,
                "properties": {
                  "primary": { "type": "string", "maxLength": 80 },
                  "produced_by": { "type": "string", "maxLength": 80 }
                },
                "description": "Optional domain attribution metadata for cross-stage tracing (S0-T8)."
              }
            }
          },
          "maxItems": 50
        }
      }
    },
    "audit_signed": {
      "type": "boolean",
      "description": "FR-6 / SDD §6.3: opt-in to cycle-098 audit_emit_signed. When true, runtime requires bootstrapped audit keys (pre-flight gate)."
    },
    "prev_hash": {
      "oneOf": [
        { "type": "null" },
        { "type": "string", "pattern": "^sha256:[0-9a-f]{64}$" }
      ],
      "description": "Hash chain linkage per SDD §3.1. null for first invocation; otherwise sha256 of prior-stage handoff envelope (JCS-canonicalized)."
    },
    "invocation_hash": {
      "type": "string",
      "pattern": "^sha256:[0-9a-f]{64}$",
      "description": "Self-hash. Computed via two-pass: canonicalize envelope WITHOUT this field, sha256 the canonical JSON, set this field to the result."
    }
  },
  "$defs": {
    "StreamRef": {
      "type": "object",
      "additionalProperties": false,
      "required": ["type", "uri", "schema_id", "hash"],
      "properties": {
        "type": {
          "type": "string",
          "enum": ["Signal", "Verdict", "Artifact", "Intent", "OperatorModel"]
        },
        "uri": {
          "type": "string",
          "maxLength": 400,
          "description": "Path or URI of the stream payload."
        },
        "schema_id": {
          "type": "string",
          "pattern": "^loa\\.stream\\.[A-Za-z]+\\.v[0-9]+$",
          "maxLength": 80
        },
        "hash": {
          "type": "string",
          "pattern": "^sha256:[0-9a-f]{64}$",
          "description": "Content-addressed integrity check; re-hashed at run time."
        },
        "domain": {
          "type": "object",
          "additionalProperties": false,
          "properties": {
            "primary": { "type": "string", "maxLength": 80 },
            "produced_by": { "type": "string", "maxLength": 80 }
          },
          "description": "Optional domain attribution carried with the stream reference (S0-T8)."
        }
      }
    }
  }
}
