{
  "schema_version": "loa.construct.invocation.v0",
  "run_id": "run_test_2026_05_08_001",
  "composition_id": "audit-feel.yaml@sha256:a3f2b1d4e5c6",
  "stage_id": "audit-feel.stage-1",
  "stage_pass": 1,
  "construct": {
    "slug": "artisan",
    "version": "1.0.0",
    "persona": "ALEXANDER",
    "skill": "decomposing-feel"
  },
  "domain": {
    "primary": "interface-craft",
    "active_language": ["material", "rhythm", "affordance", "motion"],
    "invariants": [
      "craft judgment must be tied to observable surface evidence"
    ]
  },
  "mode": "fresh",
  "input_streams": [
    {
      "type": "Intent",
      "uri": "grimoires/loa/runs/run_test_2026_05_08_001/input.intent.json",
      "schema_id": "loa.stream.Intent.v1",
      "hash": "sha256:0000000000000000000000000000000000000000000000000000000000000001"
    }
  ],
  "allowed_context": {
    "methodology": [
      ".claude/constructs/packs/artisan/skills/decomposing-feel/SKILL.md"
    ],
    "topology": [
      "grimoires/loa/prd.md"
    ],
    "operator_model": [
      "grimoires/loa/context/operator-model.md"
    ]
  },
  "context_policy": {
    "include_prior_transcript": false,
    "include_unread_stage_outputs": false,
    "include_unlisted_grimoires": false,
    "allowed_read_paths": [
      "grimoires/loa/runs/run_test_2026_05_08_001/**",
      ".claude/constructs/packs/artisan/skills/decomposing-feel/**"
    ],
    "allowed_write_paths": [
      ".run/compose/run_test_2026_05_08_001/stage-1/output/**"
    ],
    "allowed_env_vars": ["PATH", "HOME", "LANG"],
    "allow_network": false,
    "allowed_egress": [],
    "llm_session_strategy": "fresh",
    "allowed_mcp_tools": [],
    "isolation_tier": "advisory"
  },
  "output_contract": {
    "writes": [
      {
        "type": "Signal",
        "schema_id": "loa.stream.Signal.v1",
        "destination": ".run/compose/run_test_2026_05_08_001/stage-1/output/decomposition.signal.json",
        "required": true
      }
    ]
  },
  "prev_hash": null,
  "invocation_hash": "sha256:0000000000000000000000000000000000000000000000000000000000000abc"
}
